{"version":"openaction-receipt/1.0-rc1","id":"oar_demo_clinical_001","decision":"approved","scope":{"subject":"oa_careos_followup_001","environment":"pilot","organisation":"Synthetic Hospital","use_case":"discharge follow-up","version":"careos-demo-1"},"approver":{"type":"qualified_human","id":"clinician-demo-01","role":"clinical pilot reviewer","identity_provider":"synthetic-org-idp"},"decided_at":"2026-08-24T09:35:00Z","expires_at":"2026-09-24T09:35:00Z","conditions":["human confirmation required before any external communication","pilot users only"],"reason":"Synthetic example approval for bounded pilot.","evidence_snapshot":{"sha256":"aaaaaaaaaaaaaaaaaaaaaaaaaaaaaaaaaaaaaaaaaaaaaaaaaaaaaaaaaaaaaaaa","items":["ev_task_001","trust-passport-demo-v1"]},"proof":{"type":"organisational_signature","verification_method":"synthetic://org/idp/demo","value":"SYNTHETIC-NOT-A-REAL-SIGNATURE"}}